{
  "$schema": "../../../schema/jwsim-test-1.json",
  "$comment": "put() y get() de un struct de configuración en la FRAM (CS en el GPIO13): se recupera igual que se guardó. Hasta alpha.13 el ejemplo usaba el CS del W5500 (GPIO5) y el struct salía vacío (hallazgo H18, corregido en alpha.14).",
  "sketch": "package:libraries/JW_FRAM/examples/Struct_Config",
  "until_ms": 1500,
  "expect": {
    "console": [
      "^JW_FRAM::begin\\(\\) usando tamano de FRAM forzado$",
      "^Size bytes: 8192$",
      {
        "match": "^Struct recuperado:$",
        "count": 1
      },
      "^Modo: 2$",
      "^Enabled: true$",
      "^Kp: 1\\.500$",
      "^Machine: JWPLC_Basic_V2$"
    ],
    "console_absent": [
      "^Fallo al inicializar la FRAM"
    ]
  }
}
