{
  "$schema": "../../../schema/jwsim-test-1.json",
  "$comment": "Los campos se registran sin error y la navegación completa (UP en IDLE sin despertar, OK a USER, RIGHT motor, UP/DOWN nivel hasta los topes, ESC a IDLE, OK de nuevo) corre sin FATAL ni salida espuria en la consola. El sketch no informa nada más por Serial: el contenido de los campos se verifica con capturas de la pantalla (IDLE, USER, nivel en el tope, motor).",
  "sketch": "package:libraries/JWPLC_Display/examples/02.Display_HMI_Fields",
  "until_ms": 9000,
  "stim": [
    "1500 BTN_UP=1",
    "1600 BTN_UP=0",
    "1900 BTN_OK=1",
    "2000 BTN_OK=0",
    "2300 BTN_RIGHT=1",
    "2400 BTN_RIGHT=0",
    "2700 BTN_UP=1",
    "2800 BTN_UP=0",
    "3000 BTN_UP=1",
    "3100 BTN_UP=0",
    "3300 BTN_UP=1",
    "3400 BTN_UP=0",
    "3600 BTN_UP=1",
    "3700 BTN_UP=0",
    "3900 BTN_UP=1",
    "4000 BTN_UP=0",
    "4200 BTN_UP=1",
    "4300 BTN_UP=0",
    "4500 BTN_UP=1",
    "4600 BTN_UP=0",
    "4800 BTN_DOWN=1",
    "4900 BTN_DOWN=0",
    "5100 BTN_RIGHT=1",
    "5200 BTN_RIGHT=0",
    "5500 BTN_ESC=1",
    "5600 BTN_ESC=0",
    "6000 BTN_DOWN=1",
    "6100 BTN_DOWN=0",
    "6500 BTN_OK=1",
    "6600 BTN_OK=0",
    "7500 BTN_ESC=1",
    "7600 BTN_ESC=0"
  ],
  "expect": {
    "console": [
      {
        "match": "^JWPLC Basic - HMI fields$",
        "count": 1
      },
      {
        "match": "^OK=USER \\| RIGHT=MOTOR \\| UP\\/DOWN=NIVEL \\| ESC=IDLE$",
        "count": 1
      },
      {
        "match": ".",
        "count": 0,
        "after_ms": 1200
      }
    ],
    "console_absent": [
      "^ERROR"
    ],
    "screen": [
      {
        "at_ms": 1800,
        "ref": "screens/02.Display_HMI_Fields_idle.png"
      },
      {
        "at_ms": 2200,
        "ref": "screens/02.Display_HMI_Fields_user.png"
      },
      {
        "at_ms": 4700,
        "ref": "screens/02.Display_HMI_Fields_nivel_max.png"
      },
      {
        "at_ms": 5400,
        "ref": "screens/02.Display_HMI_Fields_motor.png"
      }
    ]
  }
}
